{
  "$schema": "https://json-schema.org/draft/2020-12/schema",
  "$id": "https://behaverse.org/schemas/instrument/v26.0605/schema.json",
  "title": "Instrument Metadata",
  "description": "Bibliographic and psychometric properties for an instrument. See docs/superpowers/specs/2026-05-28-schemas-1-and-2-design.md §2.",
  "type": "object",
  "required": ["id", "title", "description", "language"],
  "properties": {
    "id": {
      "type": "string",
      "pattern": "^[a-z]+_[a-z0-9_]+$",
      "minLength": 3,
      "maxLength": 64
    },
    "title": { "type": "string", "minLength": 1, "maxLength": 256 },
    "description": { "type": "string", "minLength": 1, "maxLength": 2048 },
    "language": { "$ref": "#/$defs/LanguageCode" },
    "short_title": { "type": "string", "minLength": 1, "maxLength": 64 },
    "version": { "$ref": "#/$defs/Version" },
    "author": {
      "type": "array",
      "items": { "$ref": "#/$defs/Author" }
    },
    "available_languages": {
      "type": "array",
      "items": { "$ref": "#/$defs/LanguageCode" },
      "uniqueItems": true
    },
    "timestamps": {
      "type": "object",
      "properties": {
        "created":   { "type": "string", "format": "date-time" },
        "modified":  { "type": "string", "format": "date-time" },
        "published": { "type": "string", "format": "date-time" }
      },
      "additionalProperties": false
    },
    "publication": {
      "type": "object",
      "required": ["year", "citation"],
      "properties": {
        "year":      { "type": "integer", "minimum": 1800, "maximum": 2100 },
        "citation":  { "type": "string", "minLength": 1 },
        "doi":       { "type": "string", "pattern": "^10\\.\\d+/.+$" },
        "isbn":      { "type": "string" },
        "publisher": { "type": "string" },
        "url":       { "type": "string", "format": "uri" }
      },
      "additionalProperties": false
    },
    "license": {
      "enum": [
        "public_domain", "cc0", "cc_by", "cc_by_nc", "cc_by_sa",
        "proprietary_open_redistribution", "proprietary_restricted",
        "unknown", "mixed_see_components"
      ]
    },
    "license_notes": { "type": "string", "maxLength": 1024 },
    "rights_holder": { "type": "string" },
    "request_url":   { "type": "string", "format": "uri" },
    "usage": {
      "type": "object",
      "properties": {
        "requires_permission": { "type": "boolean" },
        "cost":                { "enum": ["free", "paid", "negotiable"] },
        "clinical_use_only":   { "type": "boolean" },
        "training_required":   { "type": "boolean" }
      },
      "additionalProperties": false
    },
    "provenance": {
      "type": "object",
      "description": "Imported-content only. See design/13_importers.md.",
      "properties": {
        "source":                 { "type": "string" },
        "source_version":         { "type": "string" },
        "imported_at":            { "type": "string", "format": "date-time" },
        "imported_by":            { "type": "string" },
        "import_loss_report_url": { "type": "string", "format": "uri" },
        "importer_version":       { "type": "string" }
      },
      "additionalProperties": false
    },
    "classification": {
      "type": "object",
      "properties": {
        "domain": {
          "type": "array",
          "items": { "type": "string", "minLength": 1, "maxLength": 64 }
        },
        "population": {
          "type": "array",
          "items": { "type": "string", "minLength": 1, "maxLength": 64 }
        },
        "tags": {
          "type": "array",
          "items": { "type": "string", "minLength": 1, "maxLength": 64 }
        },
        "age_range": {
          "type": "array",
          "prefixItems": [
            { "type": "integer", "minimum": 0, "maximum": 120 },
            { "type": "integer", "minimum": 0, "maximum": 120 }
          ],
          "items": false,
          "minItems": 2,
          "maxItems": 2
        },
        "administration_mode": {
          "type": "array",
          "items": {
            "enum": ["self_report", "interviewer", "observer", "informant", "performance"]
          },
          "uniqueItems": true
        }
      },
      "additionalProperties": false
    },
    "psychometrics": {
      "type": "object",
      "properties": {
        "item_count":        { "type": "integer", "minimum": 1 },
        "estimated_minutes": { "type": "number",  "minimum": 0 },
        "reliability": {
          "type": "array",
          "items": {
            "type": "object",
            "required": ["type", "value"],
            "properties": {
              "type":        { "type": "string" },
              "value":       { "type": "number" },
              "population":  { "type": "string" },
              "sample_size": { "type": "integer", "minimum": 1 },
              "ci_lower":    { "type": "number" },
              "ci_upper":    { "type": "number" },
              "citation":    { "type": "string" }
            },
            "additionalProperties": false
          }
        },
        "validity": {
          "type": "array",
          "items": {
            "type": "object",
            "required": ["type", "value"],
            "properties": {
              "type":        { "type": "string" },
              "value":       { "type": "number" },
              "comparator":  { "type": "string" },
              "population":  { "type": "string" },
              "sample_size": { "type": "integer", "minimum": 1 },
              "citation":    { "type": "string" }
            },
            "additionalProperties": false
          }
        },
        "norms": {
          "type": "array",
          "items": {
            "type": "object",
            "required": ["population"],
            "properties": {
              "population": { "type": "string" },
              "n":          { "type": "integer", "minimum": 1 },
              "mean":       { "type": "number" },
              "sd":         { "type": "number" },
              "median":     { "type": "number" },
              "percentiles": {
                "type": "object",
                "patternProperties": { "^p\\d{1,2}$": { "type": "number" } },
                "additionalProperties": false
              },
              "citation":   { "type": "string" }
            },
            "additionalProperties": false
          }
        }
      },
      "additionalProperties": false
    },
    "translations": { "$ref": "#/$defs/InlineTranslations" },
    "extensions":   { "type": "object" }
  },
  "patternProperties": { "^x_": {} },
  "additionalProperties": false,
  "$defs": {
    "LanguageCode": {
      "type": "string",
      "pattern": "^[a-z]{2,3}(-[A-Z][a-z]{3})?(-[A-Z]{2})?$",
      "description": "BCP-47 language tag. Resolution falls back from most-specific to base to canonical."
    },
    "Version": {
      "type": "string",
      "pattern": "^v\\d{2}\\.\\d{4}(\\.dev\\d+)?$",
      "description": "Calendar version vYY.MMDD per Behaverse schemas policy. Optional .devN suffix for in-development iterations on the same date."
    },
    "Author": {
      "type": "object",
      "required": ["name"],
      "properties": {
        "name":        { "type": "string", "minLength": 1 },
        "orcid":       { "type": "string", "pattern": "^\\d{4}-\\d{4}-\\d{4}-\\d{3}[0-9X]$" },
        "affiliation": { "type": "string" },
        "email":       { "type": "string", "format": "email" }
      },
      "additionalProperties": false
    },
    "InlineTranslations": {
      "type": "object",
      "patternProperties": {
        "^[a-z]{2,3}(-[A-Z][a-z]{3})?(-[A-Z]{2})?$": {
          "type": "object",
          "required": ["status", "fields"],
          "properties": {
            "status": { "enum": ["draft", "complete", "validated"] },
            "fields": {
              "type": "object",
              "description": "Sparse parallel mirror of the entity's translatable fields."
            }
          },
          "additionalProperties": false
        }
      },
      "additionalProperties": false
    }
  }
}
